{
  "schema": "relkit.project/1",
  "product": "sim-s2-manager",
  "channels": [
    "dev",
    "stable"
  ],
  "versionPolicy": {
    "schema": "relkit.version-policy/1",
    "targets": {
      "windows-amd64": {
        "mode": "in-place",
        "allowInstallOnly": false,
        "allowSwitch": false,
        "allowRollback": true
      }
    }
  },
  "selectorDimensions": [
    "os",
    "arch"
  ],
  "operatorRef": "firoyang-public",
  "trustFingerprint": "sha256:8bcb6c24c9ce672f315f96eff446d9cee7edd2c6f3bfa113a3d4927f00199598",
  "roles": [
    "publisher",
    "updater-host",
    "subscriber"
  ],
  "artifactProducer": {
    "command": [
      "node",
      "../../scripts/producer.mjs"
    ],
    "extensionSchema": "relkit.extension/1",
    "timeoutSeconds": 5400,
    "envAllowlist": [
      "PATH",
      "RELKIT_CORE",
      "CI",
      "SYSTEMROOT",
      "SystemRoot",
      "TEMP",
      "TMP",
      "LOCALAPPDATA",
      "APPDATA",
      "USERPROFILE",
      "HOME",
      "CARGO_HOME",
      "RUSTUP_HOME",
      "LIB",
      "INCLUDE",
      "LIBPATH",
      "EXTERNAL_INCLUDE"
    ],
    "permissions": [
      "read-workspace",
      "write-out-dir",
      "exec-self"
    ]
  },
  "runtimeProfilePublication": {
    "rootFingerprint": "sha256:9a4150c04bdbfe3b087783c727512b207b05cb21c7d5a2d85d614595f378e8a1",
    "rupSchemaSet": "rup.v2",
    "recovery": {
      "message": "SIM auto-update unavailable. This product is a relkit simulated consumer used for update contract validation only.",
      "links": [
        {
          "label": "relkit",
          "url": "https://github.com/shichao402/relkit"
        }
      ]
    }
  },
  "runtimeProfileSubscriptions": [
    {
      "productRef": "sim-s2-manager",
      "rootFingerprint": "sha256:9a4150c04bdbfe3b087783c727512b207b05cb21c7d5a2d85d614595f378e8a1"
    },
    {
      "productRef": "sim-s2-managed",
      "rootFingerprint": "sha256:41524378a0bad9a98830afc2731ad0d34178a7c1ab59a5943a2b15542ea36d03"
    }
  ],
  "capabilityFingerprint": {
    "osArch": [
      "windows-amd64"
    ],
    "facades": [
      "rust"
    ],
    "projections": [],
    "topology": "manager-managed-products",
    "subscriptions": [
      "sim-s2-manager",
      "sim-s2-managed"
    ],
    "requiredContracts": [
      {
        "domain": "publishProtocol",
        "peer": "agent",
        "min": 2,
        "max": 3
      },
      {
        "domain": "artifactSet",
        "peer": "producer",
        "id": "relkit.artifact-set/1"
      },
      {
        "domain": "updaterIpc",
        "peer": "facade",
        "min": 3,
        "max": 3
      }
    ]
  }
}
