{
  "schema": "relkit.project/1",
  "product": "sim-s2-managed",
  "channels": [
    "dev",
    "stable"
  ],
  "versionPolicy": {
    "schema": "relkit.version-policy/1",
    "targets": {
      "windows-amd64": {
        "mode": "library",
        "retain": 3,
        "allowInstallOnly": true,
        "allowSwitch": true,
        "allowRollback": true
      }
    }
  },
  "selectorDimensions": [
    "os",
    "arch"
  ],
  "operatorRef": "firoyang-public",
  "trustFingerprint": "sha256:8bcb6c24c9ce672f315f96eff446d9cee7edd2c6f3bfa113a3d4927f00199598",
  "roles": [
    "publisher",
    "updater-projection"
  ],
  "artifactProducer": {
    "command": [
      "node",
      "../../scripts/producer.mjs"
    ],
    "extensionSchema": "relkit.extension/1",
    "timeoutSeconds": 5400,
    "envAllowlist": [
      "PATH",
      "RELKIT_CORE",
      "CI",
      "SYSTEMROOT",
      "SystemRoot",
      "TEMP",
      "TMP",
      "LOCALAPPDATA",
      "APPDATA"
    ],
    "permissions": [
      "read-workspace",
      "write-out-dir",
      "exec-self"
    ]
  },
  "runtimeProfilePublication": {
    "rootFingerprint": "sha256:41524378a0bad9a98830afc2731ad0d34178a7c1ab59a5943a2b15542ea36d03",
    "rupSchemaSet": "rup.v2",
    "recovery": {
      "message": "SIM auto-update unavailable. This product is a relkit simulated consumer used for update contract validation only.",
      "links": [
        {
          "label": "relkit",
          "url": "https://github.com/shichao402/relkit"
        }
      ]
    }
  },
  "runtimeProfileSubscriptions": [],
  "capabilityFingerprint": {
    "osArch": [
      "windows-amd64"
    ],
    "facades": [],
    "projections": [
      "typescript"
    ],
    "topology": "managed-product",
    "subscriptions": [],
    "requiredContracts": [
      {
        "domain": "publishProtocol",
        "peer": "agent",
        "min": 2,
        "max": 3
      },
      {
        "domain": "artifactSet",
        "peer": "producer",
        "id": "relkit.artifact-set/1"
      }
    ]
  }
}
